{"recordType":"nutrition-food-assertion-snapshot","schemaVersion":"1.0.0","assertionId":"food-snapshot-apple-001","source":{"id":"synthetic-reference-table","release":"2026-08-19"},"nutrientAssertions":[{"id":"nutrient-energy-001","nutrientId":"energy","quantity":{"value":"52","unit":"kcal","basis":"100 g"},"source":{"id":"synthetic-reference-table","release":"2026-08-19"}}],"mediaRetention":{"containsRawPhoto":false,"containsReceiptImage":false,"containsRawAudio":false,"containsAppearanceEmbedding":false,"containsRawWearablePayload":false}}
